"name"	"bios"
"simone-biles"	"['“I’m not the next Usain Bolt or Michael Phelps – I’m the first Simone Biles,” said the American gymnastic powerhouse at the Rio 2016 Olympic Games, and her comment struck a chord. Still just 22, Biles is already in an extremely exclusive ‘legendary’ category of Olympians, occupied by the likes of the Jamaican sprinter and American swimmer. She is already the greatest gymnast that ever lived. But she’s also doing it her own way.', 'Biles rose to fame in 2013 – winning two World Championship golds aged just 16, including the all-around title. She followed that with four Worlds golds in 2014 and another four in 2015.', 'By the time Rio 2016 – her first Olympics – rolled around, she was already a superstar and the hottest of hot favourites for the title. She didn’t disappoint: Biles won gold in the all-around, team, vault and floor, and bronze on the beam.', 'Tokyo 2020 will be the opportunity to cement her Olympic legacy. Gymnastic peak young, and it is unknown whether she will want to push herself physically and mentally into another Olympic cycle for Paris 2024. This summer is a key opportunity for Biles to make a remarkable statement. She has the ability to win golds across the board.', 'Her dominance is built on an utter mastery of gymnastic basics: with a tiny 4 foot 8 frame, incredible athletic ability and power, plus a low centre of gravity, she is built to be the ultimate gymnast. Add in supreme levels of hard work, a great imagination when it comes to her craft, and megawatt levels of personality, and she is almost unbeatable.', 'That imagination was on show last year at the World Championships in Stuttgart - at which she won five golds including the all-around title - when she came up with two different new skills which will be named after her in the women’s code of points. Biles wowed fans and judges with a triple twisting double tuck on the floor, and a double twisting double tuck dismount off the balance beam, which had previously only existed in gymnastics fans’ imaginations before Biles made them reality. Perhaps now the world’s most recognisable Olympian, all eyes will be on her to see what she can do in Tokyo.']"
"michael-phelps-ii"	"['Michael Phelps is arguably the greatest Olympian ever. Some might argue that Usain Bolt, Carl Lewis or Nadia Comaneci have a claim. But for sheer numbers of medals claimed, there is a clear, hands-down winner: Michael Phelps. Even given the fact that Phelps practices a sport in which extremely capable athlete can bag golds across different distances and strokes, his feats still blow away those of any other sportsperson.', 'Phelps has 28 medals in total: his 23 gold medals are more than double the count of his nearest rivals, and its not as if other swimmers have accrued silly numbers of medals, either. Apart from Spitz, Matt Biondi (USA, eight golds) and Jenny Thompson (USA, eight golds), no other swimmer worldwide has managed more than six gold medals in total. 23 is astonishing.', 'Phelps was born in Baltimore on June 30, 1985, and got serious with the sport after joining the North Baltimore Aquatic Club. He was raised by mother Deborah, alongside his sisters Hilary and Whitney, after his parents divorced.', 'A prodigy at his sport, he went to Sydney 2000 aged just 15 –the youngest man in the USA team for an Olympic Games in 68 years). He came close to the podium only in the 200m butterfly, where he finished fifth. From then on, he would dominate the next four Games, finishing the most decorated athlete at every one. In Athens he won six gold medals and two bronzes, falling just short of Mark Spitz’s world record (seven golds at Munich 1972).', 'Beijing 2008 would see the greatest ever medal haul by a single athlete in an Olympic Games. Phelps won eight golds – every event he entered – and broke World Records in seven of them. His record looks unlikely to be surpassed any time soon.', 'London 2012 was also astonishing – he got four golds and two silvers – while Rio 1016 saw him stage a historic comeback (he had decided to retire after London), aged 31, to bag five gold medals and one silver.', 'He is now retired and is married to Nicole, with whom he has three sons, Boomer, Becker, and Maverick. Phelps works for his own charitable foundation, which has a particular emphasis on the mental health of children.']"
"v-sindhu-pusarla"	"['Pusarla Venkata Sindhu is arguably the most prolific Indian badminton star of the 21st century. As the first Indian woman to win a silver medal at the Olympics and gold at the BWF World Championships, the World Champion is in a class by herself when it comes to Indian badminton in the 21st century.', 'Along with fellow badminton player Saina Nehwal and boxer Mary Kom, she has been one of the shining beacons for sportswomen in India. Currently ranked at world number seven, shuttler PV Sindhu remains as one of India’s biggest hopes in badminton as the nation gears up for Tokyo 2020.\xa0', 'PV Sindhu was born on July 5, 1995, in Hyderabad, Andhra Pradesh to parents who were both volleyball players at the national level, with her father PV Ramana winning the bronze medal at the 1986 Seoul Asian Games. As a result, sport already coursed through her veins from the start.', 'While her parents may have been volleyball players, badminton caught PV Sindhu’s fancy after watching Pullela Gopichand in action, and by the age of eight, she was a regular at the sport.', 'The tables were soon turned, however, as Gopichand was the one in awe after watching the young PV Sindhu in action, who had joined the academy bearing his name.\xa0', 'Winning junior badminton titles like the All India Ranking Championship and the Sub-Junior Nationals, PV Sindhu made it clear she would be a player to reckon with once she made it to the international stage.', 'In 2009, PV Sindhu won the bronze medal in the sub-junior Asian Badminton Championships and a year later, she bagged singles silver in the International Badminton Challenge in Iran', 'One of the peculiarities about PV Sindhu’s career graph is her steady improvement at annual events year-by-year. This was first apparent at the 2012 Asian Junior Championships when she won the gold medal after scoring a bronze the year prior.', 'This pattern was repeated at the prestigious World Championships too. After two bronze and two silver medals between 2013 and 2018, she finally held the yellow metal in 2019 after comprehensively beating Japan’s Nozomi Okuhara 21-7, 21-7, and garnering Prime Minister Narendra Modi’s praise.', 'In her first Commonwealth Games (CWG) in 2014, PV Sindhu won bronze in women’s singles. Four years later, at the 2018 CWG in Gold Coast, she followed it up with a silver and a gold medal in the singles and mixed team badminton event respectively.', 'Her biggest achievement till date, however, remains the silver medal at Rio 2016. After eliminating Tai Tzu Ying in the round-of-16, she disposed of the second-seeded Wang Yihan and Japanese star Nozumi Okuhara in the quarter-finals and semi-finals respectively. That left her only to have to get by Spain’s Carolina Marin to win the ultimate prize.', 'While the Indian shuttler bowed down to the Spaniard’s form in all three sets, her silver medal was nonetheless an immense achievement for the nation.', 'Aside from her international success, PV Sindhu also partakes in the domestic Premier Badminton League, captaining and playing for the Hyderabad Hunters.']"
"usain-bolt"	"['Usain Bolt has been, quite simply, the face of the last three Olympic Games. To win the event’s blue riband event, the 100m, just once, guarantees Olympic immortality. To do it three times at consecutive Games, and add the 200m and 4x100m relay titles to the mix, gives him a good case to be considered the greatest athlete of all time. Still only 33, he is a living legend. Add real charm and humour to the mix, and Bolt has been the superstar that the Games needed over the last decade and a bit.', 'Bolt was born on 21 August 1986 in Sherwood Content, Jamaica. He grew up as a sports-obsessed kid, excelling in football and cricket. At high school, his cricket coach encouraged him to try athletics seriously. It was a good decision, By the age of 16, in 2002, he was world junior champion.', 'By 2007, he was the fastest man in history, setting his first 100m world record, and a year later, at the Beijing 2008 Olympic Games, he rose to international superstardom. In China, Bolt triumphed in the men’s 100m sprint, and then added the 200m and 4x100m title to secure a legendary triple. He broke the world record in all three events.', 'Further magic was to follow. At London 2012 he bagged the 100m again (beating his own Olympic record), added the 200m title, and then teamed up with the other Jamaican sprinters to take the 4x100m. A ‘double triple’ had been secured. That became the ‘triple triple’ at Rio 2016. Despite entering the Games not quite looking his best, Bolt once again secured all three titles – 100m, 200m and 4x100m – to make history once more.', 'Bolt had to return his 4x100m medal for Beijing 2008 after his teammate Nestor Carter was retroactively banned for a doping violation, but his personal record remains impeccable – and his sprinting record haul surely unbeatable.', 'Since his retirement in 2018, Bolt has remained extremely popular and high profile. He attempted to become a professional footballer – training with sides like Borussia Dortmund and Central Coast Mariners, as well as playing at Soccer Aid – and has got several business interests, including a new range of electric scooters.', 'Always a hit at personal appearances – he cropped up at the 2019 Super Bowl, where he equalled the fastest ever 40-yard dash – it seems like there will be a lot more to come from Bolt. The main challenge for the Olympic Games over the next decade? Finding another superstar of his stature.']"
"naomi-osaka"	"['Naomi Osaka will enter the postponed Tokyo 2020 Olympic Games as the first Asian tennis player to reach world No.1, the first Japanese-born player to win a grand slam and one of the standout home-town favourites for gold. Do not bet against her creating yet more history in Japan’s capital city.', 'Born to a Japanese mother and Haitian father, Osaka first grabbed the headlines in 2016. Aged 19, a string of fine performances secured the coveted Women’s Tour Association (WTA) Newcomer of the Year award. It was just the start.', 'After consolidating her gains in 2017, Osaka’s standout 2018 began by defeating the then-world No.1 Simona Halep on her way to a first WTA title at the prestigious Indian Wells tournament in March. Seven months later she took it to a whole new level by defeating her all-time idol Serena Williams in the final of the US Open.', 'While the match was marred by controversy, with Williams heavily penalised for an ongoing argument with the umpire, there is no doubt who the better player was. Osaka bossed it from start to finish. Despite facing Williams who was going for a record-breaking 24th grand slam title in front of her home crowd, Osaka remained unflustered throughout. A 114mph (183 km/h) service winner secured a 6-2 6-4 win and her own slice of history.', '“It was always my dream to play Serena in the US Open finals,” said Osaka, who was brought up in the USA from the age of three.', 'She was back in dreamland in her very next major. Made to work throughout, Osaka battled to the final of the 2019 Australian Open where she faced two-time Wimbledon champion Petra Kvitova. After blowing three match points in the second set, Osaka edged a thrilling third to become the first back-to-back grand slam winner in the women’s game since Jennifer Capriati in 2001. It was the type of performance that generates gold medal chat.', '“I am worried because of the high expectations from the surroundings,” Osaka said of Tokyo 2020. “But I want to play like me and get a gold medal.”']"
"katie-ledecky"	"['It can not be easy to be billed as a future female Michael Phelps. But after pulling off a surprise gold medal at London 2012 at the age of 15, and a subsequent five golds at the 2015 Worlds, it was perhaps no surprise that the Washington swimmer ended up being the second most-decorated Olympian in Rio 2016 after the pool legend and USA flag bearer she’s oft-compared to.', 'Ledecky’s London performance remains astonishing. Having qualified for the 800m freestyle final third overall, she surprised the field by taking gold in the final by more than four seconds – and breaking an American record that had stood since 1989.', 'Going into the Rio Games, then, a lot was expected – and Ledecky didn’t disappoint. She bagged the 200m, 400m, 800m and 4x200m freestyle (two of them in World Record times), fending off incredibly tough competition from the likes of Sarah Sjostrom.', '“She’s always pursuing her personal best with fury,” says Dave Marsh, coach of the U.S. Olympic women’s team. “Where’s the fury coming from? We don’t know, but the stove is running hot.”', 'Ledecky is the current world record holder in the women’s 400m, 800m and 1500m freestyle – breaking the latter record as recently as 2018. With five Olympic golds and 15 World Championship titles, Ledecky is female swimming’s most decorated ever athlete.', 'Can she keep going, through Tokyo 2020 and Paris 2024, and truly emulate Phelps? Turning 23 this March, it’s a huge ask to maintain such levels for another two or three Olympics like Phelps – but Ledecky certainly has ambition. She is planning to race four distances in Japan, including the newly-added 1500m freestyle.', '“I have no plans of dropping anything,” she said recently about the possibility of four events being too much to manage. “Plans could change, but I think I still have a lot in me. I think I’m very experienced swimming those events. I think I know how to manage my races and manage my energy.”', 'Adding four more golds to her incredible haul of five already? Don’t bet against it happening. Ledecky is a swimmer on a mission – and the stove looks like it is going to run hot for some time yet.']"
"yuzuru-hanyu"	"['All eyes may be on Japan’s summer athletes as Tokyo 2020 dawns, but there’s another Olympics in Asia a couple of years later, and – in Japan – Hanyu is the man that the fans want to see in Beijing 2022.', 'Already a two-time Olympic champion, a two time World Champion, and four time Grand Prix final champion, the figure skater is perhaps his country’s finest ever ice athlete – and regarded by many as the best figure skater in history.', 'He has broken an extraordinary 18 world scoring records, and still holds the current world record for the short program. He’s the first man ever to break the 100 point mark in short program, the first to gain 200 points in free skating, and the first to get a combined total of 300.', 'He’s also the first Asian skater to win an Olympic gold, a feat he achieved aged just 19 at the Sochi 2014 Olympic Winter Games. This made him the youngest winner of the title since 1948. Hanyu then followed up that amazing performance with a gold at PyeongChang 2018.', 'How does he do it? Hanyu’s technique is simply outstanding, but he combines his ability with an astonishing creativity and artistry. He makes difficult moves like the Beillmann spin and the doughnut spin look simple, and is well known for his ability to perform complex triple Axels. He’s also thought to be the first ever figure skater to successfully land a quadruple loop in an International Skating Union sanctioned competition – a feat he pulled off in Montreal, Canada, in 2016.', 'A huge presence in Japan, he is a star of TV and film as well as arguably the country’s most famous athlete. He’s fiercely competitive - he says “to me, losing is like death” – but whether he’s going to go to Beijing 2022 remains uncertain. He answered a question about whether he’d go or not recently quite cryptically saying simply: “I managed to win twice, but the Olympics are something special. The Olympic Games are what every athlete and figure skater wants to win. Winning them makes you a true champion. I am going to look forward to thinking about who will win at the Beijing Games.""']"
"eliud-kipchoge"	"['Having taken place so recently, it’s hard to put Eliud Kipchoge’s astonishing sub two-hour marathon into context. Like Roger Bannister breaking the four minute mile in 1954, the Kenyan achieved something that many people believed physically couldn’t be done.', 'Some will argue about the details, but the facts remain remarkable. On 12 October 2019, Kipchoge ran 26.2 miles in the time of 1:59:40, across a special course in Vienna, Austria. It did not count as an official marathon world record, because standard competition rules for pacing and fluids were not followed, and it wasn’t an ‘open’ race. He was paced by a car and carefully co-ordinated team of elite runners throughout.', 'But the moment still transcended the rules: the sense of occasion and Kipchoge’s emotions afterwards ensured that the completion of the 1:59 challenge, which he had already attempted and failed once, will be seen as his crowning achievement in years to come.', 'Kipchoge, now 35, realised the significance immediately afterwards. “After Roger Bannister in 1954, it took another 63 years, I tried and I did not get it,” he said about the breakthrough. “I want to inspire many people, that no human is limited.”', 'His challenge aside, Kipchoge would have gone down as the greatest marathon runner of all time, anyway. He has won 12 of the 13 marathons he’s entered during his running career, including the Rio 2016 Olympic Games marathon, and four London marathons.', 'He also holds the marathon world record for a run during competition: a blistering time of 2:01:39, set at the 2018 Berlin marathon, and knocking a huge one minute and 18 seconds off the previous record.', 'Born in the Nandi District of Kenya, he has been running at a high level since 2002, and during his earlier career specialised in the 5000m – winning bronze at the Athens 2004 Olympic Games and silver at Beijing 2008.', 'Kipchoge is married with three children. He will head to Tokyo 2020 as hot favourite for the marathon title, and the weather should certainly suit him. The race, which takes place on 9 August, has been moved out of Tokyo to Sapporo in Northern Japan due to fear about the Japanese capital’s heat – but it should still be very warm.', 'After his heroics in Vienna, Kipchoge is set to be one of the Games’ biggest stars.']"
"nadia-comaneci"	"['Nadia Comaneci achieved perfection at the age of 14. The Romanian gymnast scored a “perfect 10” on the uneven bars in the team part of the gymnastics at the 1976 Montreal Olympic Games, and even the scoreboard didn’t know what to do: it wasn’t able to display the four digits needed to show a row of 10.00s, because nobody had even conceived that it was possible.', 'Once it was proved achievable, though, she couldn’t stop doing it: Comaneci got six more perfect tens as she swept to three gold medals (all around, uneven bars and balance beam) and international superstardom.', 'She didn’t let the fact that the only way is down from there to affect her, either. Blessed with exceptional skill, balance and a clean technique, she added two more gold medals to her Montreal one at the 1980 Olympics in Moscow (balance beam and floor), and won two World Championship golds (1978 in the balance beam and 1979 in the Team) and numerous European titles.', 'She was as innovative as she was technical, once in action. On the beam, she was the first gymnast to perform an aerial walkover and an aerial cartwheel-back handspring flight series. She also debuted the double twist dismount – and the double back salto on the floor. Her willingness to put creativity and ambition alongside technical excellence continues to influence the likes of Simone Biles.', 'But things got tough after Moscow. While she did attend the Los Angeles 1984 games as a judge, she was severely restricted from leaving Romania, and found life tough after she retired from her sport. In 1989 she defected to the USA, working as a coach, businesswoman and model – and even appearing on ', '. “I don’t run away from a challenge because I am afraid,” she has said about her extraordinary life. “Instead, I run toward it because the only way to escape fear is to trample it beneath your feet.”', 'She is still deeply involved in sports: Comaneci serves as the honorary president of the Romanian Gymnastics Federation, the honorary president of the Romanian Olympic Committee, and is a member of the International Gymnastics Federation Foundation.']"
"armand-duplantis"	"['Armand ""Mondo"" Duplantis, born in Louisiana in 1999, has long been pegged as the one to watch in men\'s pole vaulting. But few, even among the most avid track and field followers, would have expected his rise to culminate in him breaking the world record so quickly.', ""Born to an American pole vaulter father and Swedish long jumper mother, Duplantis opted to compete internationally for his mother's home country. In 2015, still four months shy of his 16th birthday, he won the world under-18 title; barely two years later he had already broken the under-20 world record with a clearance of 5.90m, attracting the attention of the great Sergey Bubka.\xa0"", 'But it was another man, Renaud Lavillenie, who was Duplantis\' idol growing up after they first met in 2013. ""I loved the way he pole vaulted. I kind of always wanted to jump like him,"" Duplantis said in 2017. That winter, he went to Clermont-Ferrand to train with the French Olympic champion for a few days.', ""The titles continued to follow, including European Championships gold in 2018. At that event, he cleared 6.05 metres – good enough to rank him as the fifth-best vaulter of all time. Duplantis chose to attend the Louisiana State University, but gave college up after a year to focus on his burgeoning professional athletics career. A year later at the 2019 Worlds in Doha, the Swede ended up with silver after a battle against American Sam Kendricks. But nothing quite prepared Duplantis' rivals or the world for what was to follow in early 2020."", ""Long before competitions around the world were halted by a global pandemic, Duplantis was beginning his season on the World Athletics Indoor Tour. After barely missing out at the season-opening event in Germany, the circuit rattled on to Poland where Duplantis was in scintillating form. He easily cleared three lower heights before brushing the bar on his first attempt at 6.17m. His second shot at the height, however, was good, replacing his friend and idol Lavillenie as the standard-bearer for men's pole vaulting. A week later, he added another centimetre to that height, ushering in fresh comparisons to Bubka, who broke the record 17 times."", 'Back in 2017, Duplantis confidently said: ""The goal right now, talking about the (Tokyo) Olympics, would be to win gold, I guess. Why not?"" Now, gold is not the only goal. The question now is, how high can Duplantis go?']"
"chungneijang-mery-kom-hmangte"	"['Mary Kom is, without doubt, one of the most fascinating athletes on the planet. It’s no wonder that she has already had a feature film made about her life: Kom’s story is remarkable. Born in a poor region of India, it looked likely that she would end up working the land with her family.', 'But – overcoming the objections from her family – she moved to the city, became a boxer after persuading a local coach to take her on, and worked her way up to becoming a champion.', 'Kom has since won a medal at all eight AIBA World Boxing Championships since its inception in 2001 (six golds, a silver and a bronze, most recently in 2019), risen to no.1 in the AIBA world rankings for a flyweight, and competed at the London 2012 Olympic Games, winning a bronze medal after being beaten by eventual champion Nicola Adams.', 'She was also the first Indian woman to win a gold medal at the Asian Games (in 2014) and at the Commonwealth Games (2018).', 'But she is a trailblazer in more ways than one. Kom has combined fighting with being a mother of three young children, she runs a sports club in her native Manipur, training youngsters to box for free, and she has become a member of the Indian Upper House of Parliament, the Rajya Sabha, campaigning on numerous issues for her fellow citizens.', 'She is an Indian national hero already – but there could yet be an amazing final chapter to her sporting career. Kom is determined to make it to Tokyo 2020 and win a gold medal. What an achievement that would be – and what a fitting end it could be to a glorious boxing career.']"
